{
  "coordinate_basis": "derived_note_utf8_not_raw_entry",
  "derived_artifact_digest": "sha256:69dabf6858e76ecb02ba591a9b454e46aeb6a2746f02753b1a6e515586c35bdd",
  "derived_artifact_path": "/Users/chenzehao/Projects/LoreBuddy/build/m1c3-obsidian-baseline/Notes/怪物图鉴2025/亡灵/幽魂.md",
  "id": "urn:uuid:e823d2f7-ff17-59a1-bc25-3c0ff7233817",
  "original_record": {
    "alias": "G25.ABILITY.7",
    "id": "urn:uuid:e823d2f7-ff17-59a1-bc25-3c0ff7233817",
    "range": {
      "basis": "whole_note_utf8",
      "end": 4334,
      "interval": "[start,end)",
      "start": 3551
    },
    "source_entry_id": "urn:uuid:b1a26be8-f173-5e7c-a9e8-1253c0018d9d",
    "text": " **附身Possession（充能6）。***魅力豁免检定：*DC13，单一5尺内幽魂可见的类人生物。 *失败：*目标被幽魂附身。幽魂消失，目标陷入失能 状态并失去对身体的控制。现在由幽魂控制身体，但目标仍然保留自我意识。幽魂不能成为任意攻击、法术或其他效应的目标，针对亡灵的效应除外。幽魂仍然保留自己的游戏数据，但是使用附身目标的速度，以及力量、敏捷与体质调整值。\n附身持续至身体的生命值降至0，或在幽魂以附赠动作解除附身时结束。附身结束时，幽魂会出现在目标5尺内一处未占据空间，且目标在24小时内免疫此幽魂的附身。\n *成功：*目标在接下来24小时内免疫幽魂的附身。\n",
    "text_sha256": "bb7b8ebf7bcbb0f26b87e95d19a6eb24802f5d43ddaca8755b9806a5044cc09b"
  },
  "raw_fragment_id": "urn:uuid:b32518f2-acd4-5874-acf6-2482d95a72d4",
  "raw_to_derived_fidelity": "not_proven_by_this_record",
  "schema": "m2.derived-text-evidence@0.1.0"
}
