{
  "coordinate_basis": "derived_note_utf8_not_raw_entry",
  "derived_artifact_digest": "sha256:69dabf6858e76ecb02ba591a9b454e46aeb6a2746f02753b1a6e515586c35bdd",
  "derived_artifact_path": "/Users/chenzehao/Projects/LoreBuddy/build/m1c3-obsidian-baseline/Notes/怪物图鉴2025/亡灵/幽魂.md",
  "id": "urn:uuid:fa67b8e9-654a-5d65-901c-94403cdeaa15",
  "original_record": {
    "alias": "G25.CARD",
    "id": "urn:uuid:fa67b8e9-654a-5d65-901c-94403cdeaa15",
    "line_range": [
      24,
      53
    ],
    "range": {
      "basis": "whole_note_utf8",
      "end": 4334,
      "interval": "[start,end)",
      "start": 1132
    },
    "source_entry_id": "urn:uuid:b1a26be8-f173-5e7c-a9e8-1253c0018d9d",
    "text": "<a id=\"Ghost\"></a>\n##### 幽魂Ghost\n\n中型亡灵，中立\n\n<table><tr><td><strong>AC </strong>11</td><td><strong>先攻 </strong>+1（11）</td></tr> <tr><td colspan=\"2\"><strong>HP </strong>45（10d8）</td></tr> <tr><td colspan=\"2\"><strong>速度 </strong>5尺，飞行40尺（悬浮）</td></tr></table>\n\n<table><tr><th></th><th></th><th>调整</th><th>豁免</th><td></td><th></th><th></th><th>调整</th><th>豁免</th><td></td><th></th><th></th><th>调整</th><th>豁免</th></tr> <tr><td><strong>力量</strong></td><td>7</td><td>-2</td><td>-2</td> <td></td> <td><strong>敏捷</strong></td><td>13</td><td>+1</td><td>+1</td> <td></td> <td><strong>体质</strong></td><td>10</td><td>+0</td><td>+0</td></tr> <tr><td><strong>智力</strong></td><td>10</td><td>+0</td><td>+0</td> <td></td> <td><strong>感知</strong></td><td>12</td><td>+1</td><td>+1</td> <td></td> <td><strong>魅力</strong></td><td>17</td><td>+3</td><td>+3</td></tr> </table>\n\n| **抗性**强酸，钝击，寒冷，火焰，闪电，穿刺，挥砍，雷鸣 |\n| --- |\n| **免疫**暗蚀，毒素；魅惑，力竭，恐慌，受擒，麻痹，石化，中毒，倒地，束缚 |\n| **感官**黑暗视觉60尺；被动察觉11 |\n| **语言**通用语，以及一门其他语言 |\n| **CR**4（XP1,100；PB+2） |\n\n###### 特质Traits\n\n**以太视界Ethereal Sight。**若幽魂身处物质位面，其能够看见60尺内的以太位面。\n **虚体移动Incorporeal Movement。**幽魂可以移动穿过其他生物或物件，如同穿过困难地形一般。在其回合结束时，若幽魂还处于物件内，其受到5（1d10）力场伤害\n\n###### 动作Actions\n\n**多重攻击Multiattack。**幽魂发动两次凋零之触攻击。\n **凋零之触Withering Touch。***近战攻击检定：*+5，触及5尺。*命中：*19（3d10+3）暗蚀伤害。\n **以太化Etherealness。**幽魂施展法术*以太化Etheralness*，无需法术成分，并使用魅力作为施法属性。当幽魂处于边界以太时，仍可以在物质位面被观测到，反之亦然。但另一位面的任何事物不能对其施加影响或被其影响。\n **恐惧面容Horrifying Visage。***感知豁免检定：*DC13，60尺锥状区域内能看见幽魂的每名非亡灵生物。*失败：*10（2d6+3）心灵伤害，目标陷入恐慌状态，直至幽魂的下个回合的开始。*成功：*目标在24小时内免疫此幽魂的恐惧面容。\n **附身Possession（充能6）。***魅力豁免检定：*DC13，单一5尺内幽魂可见的类人生物。 *失败：*目标被幽魂附身。幽魂消失，目标陷入失能 状态并失去对身体的控制。现在由幽魂控制身体，但目标仍然保留自我意识。幽魂不能成为任意攻击、法术或其他效应的目标，针对亡灵的效应除外。幽魂仍然保留自己的游戏数据，但是使用附身目标的速度，以及力量、敏捷与体质调整值。\n附身持续至身体的生命值降至0，或在幽魂以附赠动作解除附身时结束。附身结束时，幽魂会出现在目标5尺内一处未占据空间，且目标在24小时内免疫此幽魂的附身。\n *成功：*目标在接下来24小时内免疫幽魂的附身。\n",
    "text_sha256": "10f5f65c0ecf9b77793cb16f318ffc29a5dee9ba3fa75f2af342ae22f9ea9c29"
  },
  "raw_fragment_id": "urn:uuid:b32518f2-acd4-5874-acf6-2482d95a72d4",
  "raw_to_derived_fidelity": "not_proven_by_this_record",
  "schema": "m2.derived-text-evidence@0.1.0"
}
