{
  "coordinate_basis": "derived_note_utf8_not_raw_entry",
  "derived_artifact_digest": "sha256:a9059840540c273cb7c63b35c46986bf767426fbe7584892306d9493892382ee",
  "derived_artifact_path": "/Users/chenzehao/Projects/LoreBuddy/build/m1c3-obsidian-baseline/Notes/怪物图鉴2025/异怪/史拉蟾/史拉绿蟾.md",
  "id": "urn:uuid:b88af575-a594-58f9-8e13-bdb32abb1500",
  "original_record": {
    "alias": "S.ABILITY.2",
    "id": "urn:uuid:b88af575-a594-58f9-8e13-bdb32abb1500",
    "range": {
      "basis": "whole_note_utf8",
      "end": 2382,
      "interval": "[start,end)",
      "start": 2247
    },
    "source_entry_id": "urn:uuid:41afcc45-68bb-5c05-a89e-1fbd872196e4",
    "text": "**再生Regeneration。**若史拉蟾至少拥有1生命值，则其在自己回合开始时回复10生命值。\n\n###### 动作Actions\n",
    "text_sha256": "7b09abbb6352e0993a73c25adda8926f64b97b663170414eb60b7550cf021944"
  },
  "raw_fragment_id": "urn:uuid:2f037a82-6e86-5b22-b290-e00cb0335153",
  "raw_to_derived_fidelity": "not_proven_by_this_record",
  "schema": "m2.derived-text-evidence@0.1.0"
}
