{
  "coordinate_basis": "derived_note_utf8_not_raw_entry",
  "derived_artifact_digest": "sha256:4177ed87a23d32638d852102f82464663b41655e52540f7a2e648f0d0a045c8f",
  "derived_artifact_path": "/Users/chenzehao/Projects/LoreBuddy/build/m1c3-obsidian-baseline/Notes/怪物图鉴2025/元素/四元素/气元素.md",
  "id": "urn:uuid:bb23ea13-be4d-57f4-a8fe-1a2d70130cbf",
  "original_record": {
    "alias": "A.HEADER",
    "id": "urn:uuid:bb23ea13-be4d-57f4-a8fe-1a2d70130cbf",
    "range": {
      "basis": "whole_note_utf8",
      "end": 3072,
      "interval": "[start,end)",
      "start": 1796
    },
    "source_entry_id": "urn:uuid:2cc417f9-b3ff-5e61-b655-2653f61642d2",
    "text": "<a id=\"Air_Elemental\"></a>\n##### 气元素Air Elemental\n\n大型元素，中立\n\n<table><tr><td><strong>AC </strong>15</td><td><strong>先攻 </strong>+5（15）</td></tr> <tr><td colspan=\"2\"><strong>HP </strong>90（12d10+24）</td></tr> <tr><td colspan=\"2\"><strong>速度 </strong>10尺，飞行90尺（悬浮）</td></tr></table>\n\n<table><tr><th></th><th></th><th>调整</th><th>豁免</th><td></td><th></th><th></th><th>调整</th><th>豁免</th><td></td><th></th><th></th><th>调整</th><th>豁免</th></tr> <tr><td><strong>力量</strong></td><td>14</td><td>+2</td><td>+2</td> <td></td> <td><strong>敏捷</strong></td><td>20</td><td>+5</td><td>+5</td> <td></td> <td><strong>体质</strong></td><td>14</td><td>+2</td><td>+2</td></tr> <tr><td><strong>智力</strong></td><td>6</td><td>-2</td><td>-2</td> <td></td> <td><strong>感知</strong></td><td>10</td><td>+0</td><td>+0</td> <td></td> <td><strong>魅力</strong></td><td>6</td><td>-2</td><td>-2</td></tr> </table>\n\n| **抗性**钝击，闪电，穿刺，挥砍 |\n| --- |\n| **免疫**毒素，雷鸣；力竭，受擒，麻痹，石化，中毒，倒地，束缚，昏迷。 |\n| **感官**黑暗视觉60尺；被动察觉10 |\n| **语言**原初语（气族语） |\n| **CR**5（XP1,800；PB+3） |\n\n###### 特质Traits\n",
    "text_sha256": "9d9b737bd8f07e19d230d9fbc4321f238b5d3c231e7f35c676d3802f9cf1c676"
  },
  "raw_fragment_id": "urn:uuid:8327c556-e357-5aa1-8db1-9daa6cb59898",
  "raw_to_derived_fidelity": "not_proven_by_this_record",
  "schema": "m2.derived-text-evidence@0.1.0"
}
