{
  "coordinate_basis": "derived_note_utf8_not_raw_entry",
  "derived_artifact_digest": "sha256:69dabf6858e76ecb02ba591a9b454e46aeb6a2746f02753b1a6e515586c35bdd",
  "derived_artifact_path": "/Users/chenzehao/Projects/LoreBuddy/build/m1c3-obsidian-baseline/Notes/怪物图鉴2025/亡灵/幽魂.md",
  "id": "urn:uuid:0e53e7e9-91bf-5f69-8d04-0fefd7eab093",
  "original_record": {
    "alias": "G25.ABILITY.6",
    "id": "urn:uuid:0e53e7e9-91bf-5f69-8d04-0fefd7eab093",
    "range": {
      "basis": "whole_note_utf8",
      "end": 3551,
      "interval": "[start,end)",
      "start": 3252
    },
    "source_entry_id": "urn:uuid:b1a26be8-f173-5e7c-a9e8-1253c0018d9d",
    "text": " **恐惧面容Horrifying Visage。***感知豁免检定：*DC13，60尺锥状区域内能看见幽魂的每名非亡灵生物。*失败：*10（2d6+3）心灵伤害，目标陷入恐慌状态，直至幽魂的下个回合的开始。*成功：*目标在24小时内免疫此幽魂的恐惧面容。\n",
    "text_sha256": "ab283c0bf6c2c677a47ac1fec2d9554bc9bda5c941aac63f5f7be1da786b1727"
  },
  "raw_fragment_id": "urn:uuid:b32518f2-acd4-5874-acf6-2482d95a72d4",
  "raw_to_derived_fidelity": "not_proven_by_this_record",
  "schema": "m2.derived-text-evidence@0.1.0"
}
